                     PIPEACONF: 0xc0000000 (enabled, active, pf-pd, rotate 0, 8bpc)
                      HTOTAL_A: 0x0bdf0b3f (2880 active, 3040 total)
                      HBLANK_A: 0x0bdf0b3f (2880 start, 3040 end)
                       HSYNC_A: 0x0b8f0b6f (2928 start, 2960 end)
                      VTOTAL_A: 0x073b0707 (1800 active, 1852 total)
                      VBLANK_A: 0x073b0707 (1800 start, 1852 end)
                       VSYNC_A: 0x0710070a (1803 start, 1809 end)
                      PIPEASRC: 0x0b3f0707 (2880, 1800)
                 PIPEA_DATA_M1: 0x7e7816c1 (TU 64, val 0x7816c1 7870145)
                 PIPEA_DATA_N1: 0x00800000 (val 0x800000 8388608)
                 PIPEA_LINK_M1: 0x000a01e5 (val 0xa01e5 655845)
                 PIPEA_LINK_N1: 0x00080000 (val 0x80000 524288)
                      DSPACNTR: 0xd8004000 (enabled)
                    DSPASTRIDE: 0x00002d00 (180)
                      DSPASURF: 0x00072000
                     PIPECCONF: 0x00000008 (disabled, inactive, pf-pd, rotate 0, 8bpc)
                      HTOTAL_C: 0x0bdf0b3f (2880 active, 3040 total)
                      HBLANK_C: 0x0bdf0b3f (2880 start, 3040 end)
                       HSYNC_C: 0x0b8f0b6f (2928 start, 2960 end)
                      VTOTAL_C: 0x073b0707 (1800 active, 1852 total)
                      VBLANK_C: 0x073b0707 (1800 start, 1852 end)
                       VSYNC_C: 0x0710070a (1803 start, 1809 end)
                      PIPECSRC: 0x0b3f0707 (2880, 1800)
                 PIPEC_DATA_M1: 0x7e7816c1 (TU 64, val 0x7816c1 7870145)
                 PIPEC_DATA_N1: 0x00800000 (val 0x800000 8388608)
                 PIPEC_DATA_M2: 0x7e7816c1 (TU 64, val 0x7816c1 7870145)
                 PIPEC_DATA_N2: 0x00800000 (val 0x800000 8388608)
                 PIPEC_LINK_M1: 0x0000a01e (val 0xa01e 40990)
                 PIPEC_LINK_N1: 0x00008000 (val 0x8000 32768)
                 PIPEC_LINK_M2: 0x0000a01e (val 0xa01e 40990)
                 PIPEC_LINK_N2: 0x00008000 (val 0x8000 32768)
                      DSPCCNTR: 0x18004400 (disabled)
                    DSPCSTRIDE: 0x00002e00 (184)
                     PFA_CTL_2: 0x00007c7c (vscale 0.972534)
                     PFA_CTL_3: 0x00003e3e (vscale initial phase 0.486267)
                     PFA_CTL_4: 0x00007a60 (hscale 0.956055)
                     PFB_CTL_2: 0x00007c7c (vscale 0.972534)
                     PFB_CTL_3: 0x00003e3e (vscale initial phase 0.486267)
                     PFB_CTL_4: 0x00007a60 (hscale 0.956055)
                     PFC_CTL_2: 0x00007c7c (vscale 0.972534)
                     PFC_CTL_3: 0x00003e3e (vscale initial phase 0.486267)
                     PFC_CTL_4: 0x00007a60 (hscale 0.956055)
              PCH_DREF_CONTROL: 0x00005402 (cpu source downspread, ssc_source enable, nonspread_source enable, superspread_source disable, ssc4_mode downspread, ssc1 enable, ssc4 disable)
                    PCH_DPLL_B: 0x00000000 (disable, sdvo high speed no, mode (null), p2 (null), FPA0 P1 0, FPA1 P1 0, refclk default 120Mhz, sdvo/hdmi mul 1)
                      PCH_FPB0: 0x00020e08 (n = 2, m1 = 14, m2 = 8)
                      PCH_FPB1: 0x00020e08 (n = 2, m1 = 14, m2 = 8)
              PCH_DSP_CHICKEN1: 0x00400000
                     CPU_eDP_A: 0x891c430c
              BLC_PWM_PCH_CTL1: 0x80000000 (enable 1, override 0, inverted polarity 0)
              BLC_PWM_PCH_CTL2: 0x07100000 (freq 1808, cycle 0)
                 PCH_PP_STATUS: 0x80000008 (on, not ready, sequencing idle)
                PCH_PP_CONTROL: 0xabcd0007 (blacklight enabled, power down on reset, panel on)
              PCH_PP_ON_DELAYS: 0x407d0834
             PCH_PP_OFF_DELAYS: 0x02e409c4
                PCH_PP_DIVISOR: 0x00186906
                      PORT_DBG: 0x00000007 (HW DRRS off)
            RC6_RESIDENCY_TIME: 0x0374a3a9
           RC6p_RESIDENCY_TIME: 0x010efa89
          RC6pp_RESIDENCY_TIME: 0x0011bfc6
